{"calibration_context":{"analog_sample_count":15,"confidence":"LOW","limitations":["oracle_context ist partial.","Die aktuellen Markt-Analogs haben 15 Samples auf 1h, 5 auf 4h und 2 auf 12h und liegen jeweils unter minimum_samples 20.","Die passende 1h-NO_TRADE-NONE-Gruppe hat 6 directional Samples bei minimum_samples 30 und 0 resolved triggered Trades.","OI- und Flow-Perzentile haben erst 89 historische Vergleichspunkte bei minimum_samples 168 und sind unavailable.","Spot-efficiency_loss ist unavailable; Perp-efficiency_loss ist false. Aus negativem Spot-Flow bei steigendem Preis folgt keine best\u00e4tigte Absorption.","Downside und Upside haben abc_ready=false und trigger_candidate=false; deshalb kein REVERSAL_ARMED oder REVERSAL_TRIGGERED.","Der Snapshot-Spot liegt bei 1.1018 USD intrabar. Der letzte vollst\u00e4ndige 1h-Schluss liegt bei 1.0988 USD innerhalb der Zone 1.0935 bis 1.1077 USD.","Die 1h-Struktur ist HL/HH, die best\u00e4tigte 4h-Feature-Struktur LL/LH. Das begrenzt die Swing-Sicherheit.","Der vorige persistierte LONG-Forecast ist auf 1h als no_trigger ausgewertet; seine 4h- und 12h-Horizonte sind noch pending."],"scorecard_sample_count":6,"status":"uncalibrated"},"created_at_utc":"2026-09-20T15:05:37Z","evidence":{"decisive_timeframes":["1h","4h","12h","1d","1w"],"opposing_feature_ids":["relative.1h.ratio_return_pct","relative.4h.ratio_return_pct","breadth.1h.positive_fraction","flow.spot.signed_dot","flow.spot.divergence","structure.4h.transition"],"supporting_feature_ids":["structure.1h.transition","levels.1h.reactions","flow.perp.signed_dot","flow.perp.alignment","oi.1h.price_relation","extension.anchored_vwap"]},"execution_bias":"NEUTRAL","forecast_horizons":{"12h":{"direction":"FLAT","rationale":"Die letzte geschlossene 12h-Kerze fiel von 1.1241 auf 1.1008 USD. Daily bleibt HH/HL, Weekly LH/LL. Das neue kompatible 12h-Python-Outcome des 02:03-UTC-Forecasts endete abstained bei rund -1.69 Prozent, mit MFE rund +0.05 Prozent und MAE rund -4.84 Prozent, ohne Trigger, Entry oder R. Das kalibriert keine Richtung. Deshalb bleibt 12h FLAT."},"1h":{"direction":"FLAT","rationale":"Die letzte vollst\u00e4ndig geschlossene 1h-Kerze schloss bei 1.0988 USD innerhalb der Zone 1.0935 bis 1.1077 USD. Die best\u00e4tigte 1h-Struktur bleibt HL/HH und 1.0935 USD wurde erneut als failed_breakdown zur\u00fcckgewonnen. Dagegen stehen schwache DOT/BTC-Relativrenditen auf 1h und 4h sowie nur 25 Prozent positive Peers. Im j\u00fcngsten vollst\u00e4ndigen Flowfenster stieg der Preis trotz negativem Spot-Nettoflow, w\u00e4hrend Perp-Flow und Preis gemeinsam stiegen. Ohne 1h-Schluss ausserhalb der Zone bleibt 1h FLAT."},"4h":{"direction":"FLAT","rationale":"Die letzte geschlossene 4h-Kerze erholte sich von 1.0824 auf 1.1008 USD und schloss mit CLV 0.727. Gleichzeitig meldet die best\u00e4tigte 4h-Feature-Struktur LL/LH, DOT/BTC verlor im aktuellen 4h-Fenster rund 0.44 Prozent und das 4h-OI stieg leicht mit dem Preis. Die Signale widersprechen sich, deshalb bleibt 4h FLAT."}},"forecast_id":"20260920T150537Z-d4ce91c7c36c-oracle-v3","intraday_bias":"NEUTRAL","macro_bias":"NEUTRAL","market":"DOTUSD","measurement_config_sha256":"b0419c4ed2b156a6723551ea2a8cd5b32c6ed08f70261b6c0bad818b0fe445a9","oracle_config_sha256":"298a079a85bb0cc92ff6438699b9dac212f8beba447537a596ce61a9e8f3fe77","oracle_feature_version":"3.0.0","paths":{"alternative":{"then":"1.0797 USD als erste Reaktionszone pr\u00fcfen. Darunter folgen 1.0707 USD und der B/C-AVWAP-Bereich bei rund 1.06350 bis 1.06219 USD. Keinen Short intrabar vorwegnehmen.","when":"Eine vollst\u00e4ndig geschlossene 1h-Kerze schliesst unter 1.0935 USD.","why":"Ein Schluss unter 1.0935 USD w\u00fcrde den j\u00fcngsten failed_breakdown widerrufen. Die best\u00e4tigte 4h-Feature-Struktur ist LL/LH, DOT/BTC ist auf 1h und 4h schwach und nur 25 Prozent der beobachteten Peers sind auf 1h positiv. Gegen einen vorgezogenen Short sprechen die 1h-HL/HH-Struktur und der A-AVWAP bei rund 1.09196 USD."},"primary":{"then":"1.115461 USD als T1-Reaktion pr\u00fcfen. Dar\u00fcber folgen 1.123839 USD als T2 und 1.129022 USD als T3. Den Ausbruch nicht intrabar jagen.","when":"Eine vollst\u00e4ndig geschlossene 1h-Kerze schliesst \u00fcber 1.1077 USD.","why":"1.1077 USD ist das j\u00fcngste best\u00e4tigte 1h-Fraktal-Hoch. Die 1h-Struktur steht auf HL/HH, 1.0935 USD wurde zuletzt als failed_breakdown zur\u00fcckgewonnen und der Preis stieg im aktuellen Flowfenster trotz negativem Spot-Nettoflow. Schwache DOT/BTC-Relativrendite und geringe Breadth verlangen jedoch einen vollen Stundenschluss."},"squeeze_failure":{"then":"Den lokalen Bear-Case deutlich zur\u00fcckstufen. Danach liegen 1.123839 bis 1.129022 USD und anschliessend 1.1374 USD als strukturelle Marken.","when":"Eine vollst\u00e4ndig geschlossene 1h-Kerze schliesst \u00fcber 1.117 USD.","why":"Ein Schluss \u00fcber 1.117 USD w\u00fcrde den Markt klar \u00fcber die aktuelle Entscheidungszone und tiefer in den fr\u00fcheren Swing zur\u00fcckf\u00fchren."}},"primary_market":"SPOT","regime":"NO_TRADE","schema_version":1,"snapshot_generated_at_utc":"2026-09-20T14:50:59.067251Z","snapshot_sha256":"d4ce91c7c36cf686a62618fc056552cc513ba1a7374adb12e0fefef904d7a08b","strategy_version":"oracle-v3.0.0","swing_bias":"NEUTRAL","text_summary":"REFLOOP: Letzter persistierter Forecast ist 20260920T130402Z-90818c8206cb-oracle-v3; Forecast und Receipt liegen am Analyse-SHA vor. Der danach eingereichte 14:08-Entwurf bleibt als offener Draft-PR unpersistiert und wird nicht als Archiv-Forecast oder Sample verwendet. Neues Feedback: (20260920T130402Z-90818c8206cb-oracle-v3, 1h, 1.0.0) = no_trigger, forward_return +0.7377 Prozent, MFE +0.7377 Prozent, MAE -0.6284 Prozent, kein Trigger, kein Entry und kein R. Der urspr\u00fcngliche 1h-Horizont war UP und das Setup LONG ARMED \u00fcber 1.1077 USD. Grenze: Das Ergebnis zeigt nur, dass innerhalb des 1h-Fensters kein neuer vollst\u00e4ndiger 1h-Schluss \u00fcber 1.1077 USD triggerte. Konsequenz: die Schlussbest\u00e4tigung bleibt bestehen; keine Schwellenlockerung. Neues Feedback: (20260920T020316Z-25b504bbdcb4-oracle-v3, 12h, 1.0.0) = abstained, forward_return -1.6887 Prozent, MFE +0.0533 Prozent, MAE -4.8351 Prozent, kein Trigger, kein Entry und kein R. Der urspr\u00fcngliche 12h-Horizont war FLAT. Grenze: kein Trade und ein einzelnes Ergebnis kalibriert keine Richtung. Konsequenz: 12h bleibt FLAT, die Abw\u00e4rtsgefahr wird aber weiter ber\u00fccksichtigt. Die 4h- und 12h-Horizonte des letzten persistierten Forecasts bleiben pending. Elliott-Hierarchie: 0.9342 bis 0.9441 USD bleibt die h\u00f6here Wave-2-Ursprungszone. 1.0707 USD kann weiter das lokale Ende einer tieferen Unterwelle 2 sein, ist auf ATR-Zigzag-Ebene noch nicht als neuer Tiefpivot best\u00e4tigt. Die 1h-HL/HH-Struktur st\u00fctzt die Erholung, die 4h-LL/LH-Struktur widerspricht einem best\u00e4tigten Swing-Reversal. Aktuell: Macro neutral, Swing neutral, Intraday neutral, 1h FLAT, 4h FLAT, 12h FLAT; Execution NO_TRADE.","trade_setup":{"asymmetry":{"assessment":"UNFAVOURABLE","reason":"Der Markt liegt weiter zwischen 1.0935 und 1.1077 USD. Ein Long nach Schluss \u00fcber 1.1077 USD bietet bis 1.115461 USD rund 0.007761 USD Strecke gegen rund 0.0058 USD bis 1.1019 USD, also etwa 1.34 R vor Kosten. Ein Short nach Schluss unter 1.0935 USD bietet rechnerisch mehr Reststrecke, widerspricht aber der best\u00e4tigten 1h-HL/HH-Struktur und dem j\u00fcngsten failed_breakdown. Vor einer neuen Schlussbest\u00e4tigung ist keine Seite sauber genug.","reward_risk_t1":null},"direction":"NONE","failure":null,"failure_scope":"setup_and_trade","status":"NO_TRADE","target_roles":{"T1":"Kein aktives Setup; nach einem vollst\u00e4ndigen 1h-Schluss \u00fcber 1.1077 USD liegt 1.115461 USD als n\u00e4chste sinnvolle Reaktionsmarke.","T2":"Kein aktives Setup; dar\u00fcber liegt 1.123839 USD als n\u00e4chste Mean-Reversion-Marke.","T3":"Kein aktives Setup; 1.129022 USD bildet die n\u00e4chste strukturelle Entscheidung vor dem h\u00f6heren Swing-Bereich."},"targets":[],"trigger":null}}
