{"calibration_context":{"analog_sample_count":35,"confidence":"LOW","limitations":["oracle_context ist partial.","Die 1h-Markt-Analogs haben 35 Samples und sind nur descriptive_only; ihre H\u00e4ufigkeiten sind keine Erfolgswahrscheinlichkeiten.","Die vergleichbare 1h-BREAKOUT_TRIGGERED-NONE-Gruppe hat 1 directional Sample bei minimum_samples 30 und 0 resolved triggered Trades.","Die 4h-Analogs haben 11 Samples und die 12h-Analogs 4, beide unter minimum_samples 20.","OI- und Flow-Perzentile haben erst 68 historische Vergleichspunkte bei minimum_samples 168 und sind unavailable.","Spot- und Perp-Flow sind im j\u00fcngsten vollst\u00e4ndigen Stundenfenster negativ, w\u00e4hrend der Preis leicht stieg; efficiency_loss ist f\u00fcr beide unavailable.","Downside und Upside haben abc_ready=false und trigger_candidate=false; kein REVERSAL_ARMED oder REVERSAL_TRIGGERED.","Der aktuelle Spot liegt intrabar wieder unter 1.1319 USD. Der best\u00e4tigte 1h-Schluss dar\u00fcber bleibt g\u00fcltig, doch die Anschlussbewegung ist noch nicht best\u00e4tigt."],"scorecard_sample_count":1,"status":"uncalibrated"},"created_at_utc":"2026-09-19T18:02:49Z","evidence":{"decisive_timeframes":["1h","4h","12h","1d","1w"],"opposing_feature_ids":["flow.spot.signed_dot","flow.spot.alignment","flow.spot.divergence","flow.perp.signed_dot","flow.perp.alignment","flow.perp.divergence","relative.4h.ratio_return_pct","relative.4h.acceleration_pp","oi.4h.change_pct","oi.4h.price_relation","structure.1h.transition","structure.4h.transition","levels.4h.reactions"],"supporting_feature_ids":["candle.1h.clv","candle.1h.body_atr","breadth.1h.positive_fraction","breadth.1h.turn_pp","relative.1h.ratio_return_pct","relative.1h.acceleration_pp","oi.1h.change_pct","oi.1h.price_relation"]},"execution_bias":"NEUTRAL","forecast_horizons":{"12h":{"direction":"FLAT","rationale":"Daily h\u00e4lt HH/HL, Weekly bleibt LH/LL. Die 12h-Analogs haben nur 4 Samples bei minimum_samples 20. Der aktuelle 1h-Rebound st\u00e4rkt den bullischen Unterwellen-Count, liefert aber keine belastbare 12h-Fortsetzungsbest\u00e4tigung."},"1h":{"direction":"UP","rationale":"Die letzte vollst\u00e4ndig geschlossene 1h-Kerze stieg von 1.1248 auf 1.1337 USD und schloss mit CLV 0.954 nahe ihrem Hoch. Die Marktbreite liegt bei 100 Prozent, DOT/BTC gewann auf 1h rund 0.54 Prozent und das 1h-OI stieg bei steigendem Preis. Gegenwind liefern negative Spot- und Perp-Flows im j\u00fcngsten vollst\u00e4ndigen Stundenfenster sowie der weiter best\u00e4tigte 1h-Fraktalzustand LL/LH. Deshalb UP als Richtungscall, aber kein Trade vor einem 1h-Schluss \u00fcber 1.14 USD."},"4h":{"direction":"FLAT","rationale":"Die letzte geschlossene 4h-Kerze fiel von 1.1365 auf 1.1248 USD und schloss im unteren Viertel. DOT/BTC liegt auf 4h rund 0.53 Prozent tiefer und das 4h-OI stieg bei tieferem Preis. Zugleich h\u00e4lt die 4h-ATR-Zigzag-Struktur HH/HL. Der 1h-Rebound reicht deshalb noch nicht f\u00fcr einen belastbaren 4h-UP-Call."}},"forecast_id":"20260919T180249Z-3211e16c1d71-oracle-v3","intraday_bias":"BULLISH","macro_bias":"NEUTRAL","market":"DOTUSD","measurement_config_sha256":"b0419c4ed2b156a6723551ea2a8cd5b32c6ed08f70261b6c0bad818b0fe445a9","oracle_config_sha256":"298a079a85bb0cc92ff6438699b9dac212f8beba447537a596ce61a9e8f3fe77","oracle_feature_version":"3.0.0","paths":{"alternative":{"then":"1.1184 USD und danach 1.11606 USD als Reaktionsmarken pr\u00fcfen. Darunter folgen 1.1019 bis 1.0993 USD. Bei weiterem Druck liegt der steigende A-AVWAP bei rund 1.09052 USD.","when":"Eine vollst\u00e4ndig geschlossene 1h-Kerze schliesst wieder unter 1.12482 USD.","why":"1.12482 USD ist die exportierte 0.382-Retracementmarke des best\u00e4tigten 1h-Swings 1.1619 auf 1.1019 USD. Ein Schluss darunter w\u00fcrde den gerade best\u00e4tigten Reclaim \u00fcber 1.1319 USD wieder schw\u00e4chen. 1.1184 USD ist im aktuellen Feature-Satz zugleich als failed_breakdown markiert."},"primary":{"then":"1.14906 USD als erste Reaktionsmarke pr\u00fcfen. Dar\u00fcber werden 1.1571 bis 1.1619 USD zur strukturellen Entscheidung; oberhalb davon folgen 1.1691 bis 1.1705 USD. Den Ausbruch nicht jagen.","when":"Eine vollst\u00e4ndig geschlossene 1h-Kerze schliesst \u00fcber 1.14 USD.","why":"Der zuvor verlangte 1h-Schluss \u00fcber 1.1319 USD liegt jetzt vor: die Stunde schloss bei 1.1337 USD mit hohem CLV. Breadth liegt bei 100 Prozent, DOT/BTC ist auf 1h positiv und OI steigt mit dem Preis. Das aktuelle Stundenflow-Fenster ist jedoch auf Spot und Perp negativ, w\u00e4hrend 1.14 USD auf 4h weiter als failed_breakout markiert ist."},"squeeze_failure":{"then":"Den lokalen Korrekturcount deutlich zur\u00fcckstufen. 1.1691 bis 1.1705 USD werden zur n\u00e4chsten Entscheidung. Ein sauberer Bruch dar\u00fcber st\u00e4rkt die These einer impulsiven Unterwelle innerhalb der grossen Wave 3.","when":"Eine vollst\u00e4ndig geschlossene 1h-Kerze schliesst \u00fcber 1.1619 USD.","why":"1.1619 USD ist das best\u00e4tigte 1h-ATR-Zigzag-Hoch. Ein Schluss dar\u00fcber w\u00fcrde das best\u00e4tigte Higher Low bei 1.1019 USD strukturell aufwerten; ein Rebound unterhalb dieses Hochs gen\u00fcgt daf\u00fcr nicht."}},"primary_market":"SPOT","regime":"BREAKOUT_TRIGGERED","schema_version":1,"snapshot_generated_at_utc":"2026-09-19T17:50:54.684963Z","snapshot_sha256":"3211e16c1d71e11277aee3cdb820834986512319d6a1ac9c0d12cc00456bb4e2","strategy_version":"oracle-v3.0.0","swing_bias":"NEUTRAL","text_summary":"REFLOOP: Der letzte persistierte Forecast 20260919T170107Z-11b0432e2ae1-oracle-v3 ist am Analyse-SHA vollst\u00e4ndig archiviert und per Receipt an seinen serverseitig verifizierten Input gebunden; seine 1h-, 4h- und 12h-Horizonte stehen im Pending-Register auf pending. Neues Feedback: (20260919T160520Z-d69339fdd980-oracle-v3, 1h, 1.0.0) = abstained, forward_return +1.5663 Prozent, MFE +1.9153 Prozent, MAE 0.0 Prozent, kein Trigger, kein Entry und kein R. Der urspr\u00fcngliche 1h-Horizont war FLAT. Grenze: NO_TRADE ist weder Gewinn noch Verlust und ein Einzelfall kalibriert keine Richtung. Konsequenz: Der damals drohende Schlussbruch nach unten trug nicht; zusammen mit dem neuen geschlossenen Reclaim \u00fcber 1.1319 USD wird der aktuelle 1h-Richtungscall auf UP angehoben, die Ausf\u00fchrung bleibt wegen 1.14 USD und negativer aktueller Flows NO_TRADE. Neues Feedback: (20260919T130415Z-d55c1cc7235d-oracle-v3, 4h, 1.0.0) = abstained, forward_return +0.0176 Prozent, MFE +0.4142 Prozent, MAE -1.5686 Prozent, kein Trigger, kein Entry und kein R. Der urspr\u00fcngliche 4h-Horizont war FLAT. Grenze: Die breite Intrahorizon-Spanne kalibriert keine Richtung. Konsequenz: 4h bleibt FLAT. Neues Feedback: (20260919T050226Z-f99e298ae2a6-oracle-v3, 12h, 1.0.0) = abstained, forward_return +0.5219 Prozent, MFE +0.8846 Prozent, MAE -2.7512 Prozent, kein Trigger, kein Entry und kein R. Der urspr\u00fcngliche 12h-Horizont war FLAT. Grenze: keine Trade- oder Richtungskalibration. Konsequenz: 12h bleibt FLAT. Elliott-Hierarchie unver\u00e4ndert: 0.9342 bis 0.9441 USD bleibt die h\u00f6here Wave-2-Zone. Der Anstieg von 0.939 bis 1.1619 USD kann Unterwelle 1 innerhalb der grossen Wave 3 sein; 1.1019 bis 1.0993 USD bleibt Kandidat f\u00fcr deren Unterwelle 2. Der 1h-Schluss \u00fcber 1.1319 USD st\u00e4rkt den Rebound, best\u00e4tigt aber noch keinen neuen Impuls \u00fcber 1.1619 USD. Aktuell: Macro neutral, Swing neutral, Intraday bullish, 1h UP, 4h FLAT und 12h FLAT.","trade_setup":{"asymmetry":{"assessment":"UNFAVOURABLE","reason":"Der Snapshot-Spot liegt bei 1.1281 USD unter dem bereits geschlossenen Reclaim von 1.1319 USD und direkt unter 1.14 USD. Ein neuer Long braucht zuerst einen 1h-Schluss \u00fcber 1.14 USD und trifft danach rasch auf 1.14906 USD. Negative Spot- und Perp-Flows, Spread, Geb\u00fchren und Slippage verschlechtern die Restasymmetrie.","reward_risk_t1":null},"direction":"NONE","failure":null,"failure_scope":"setup_and_trade","status":"NO_TRADE","target_roles":{"T1":"Kein aktives Setup; nach einem vollst\u00e4ndig geschlossenen 1h-Schluss \u00fcber 1.14 USD ist 1.14906 USD die n\u00e4chste exportierte Reaktionsmarke.","T2":"Kein aktives Setup; dar\u00fcber bilden 1.1571 bis 1.1619 USD die n\u00e4chste strukturelle Entscheidungszone.","T3":"Kein aktives Setup; oberhalb davon folgt 1.1691 bis 1.1705 USD als n\u00e4chste gr\u00f6ssere Reaktionszone."},"targets":[],"trigger":null}}
