{"calibration_context":{"analog_sample_count":18,"confidence":"LOW","limitations":["oracle_context ist partial.","1h-Analogs haben 18, 4h-Analogs 6 und 12h-Analogs 2 Samples bei minimum_samples 20.","OI- und Flow-Perzentile haben erst 33 historische Vergleichspunkte bei minimum_samples 168.","Die sichtbare 1h-EXHAUSTION_WATCH-Gruppe hat 0 directional Samples und die 4h-Gruppe 6 bei minimum_samples 30; resolved triggered Trades sind 0.","A und C der Upside-Reversal-Pr\u00fcfung sind teilweise belegt, aber efficiency_loss_feature_ids ist leer; abc_ready=false, new_structure_confirmation=false und trigger_candidate=false.","Der Live-Spot liegt bei 1.1418 USD \u00fcber 1.14 USD, doch die letzte vollst\u00e4ndig geschlossene 1h-Kerze schloss darunter bei 1.1251 USD und markiert einen failed_breakout."],"scorecard_sample_count":0,"status":"uncalibrated"},"created_at_utc":"2026-09-18T07:05:07Z","evidence":{"decisive_timeframes":["1h","4h","12h","1w"],"opposing_feature_ids":["levels.1h.reactions","candle.1h.clv","candle.1h.ema20_distance_atr","candle.4h.ema20_distance_atr","breadth.1h.positive_fraction","breadth.1h.turn_pp","relative.1h.ratio_return_pct","relative.1h.acceleration_pp","flow.spot.signed_dot","flow.spot.alignment","flow.spot.divergence","oi.1h.change_pct","oi.1h.price_relation"],"supporting_feature_ids":["structure.1h.transition","relative.4h.ratio_return_pct","relative.24h.ratio_return_pct","flow.perp.signed_dot","flow.perp.alignment","oi.4h.change_pct","oi.4h.price_relation"]},"execution_bias":"NEUTRAL","forecast_horizons":{"12h":{"direction":"ABSTAIN","rationale":"Der letzte geschlossene 12h-Block endet weiterhin bei 1.0788 USD und bildet den aktuellen Test von 1.14 USD nicht ab. Weekly bleibt LH/LL und die 12h-Analogs liefern nur 2 Samples bei minimum_samples 20."},"1h":{"direction":"FLAT","rationale":"Die letzte geschlossene 1h-Kerze scheiterte am Level 1.14 USD, schloss bei 1.1251 USD mit CLV 0.242 und das exportierte Level-Feature markiert failed_breakout=true. Zugleich liegt der Live-Spot wieder bei 1.1418 USD. Breadth, DOT/BTC auf 1h und kurzfristiges OI schw\u00e4chen, w\u00e4hrend Perp-Flow positiv ist und kein best\u00e4tigter Strukturbruch vorliegt."},"4h":{"direction":"UP","rationale":"Die best\u00e4tigte 4h-ATR-Struktur bleibt HH/HL. DOT/BTC liegt auf 4h rund 0.94 Prozent h\u00f6her und OI steigt \u00fcber 4h zusammen mit dem Preis. Die negative relative Beschleunigung und die starke \u00dcberdehnung begrenzen die \u00dcberzeugung."}},"forecast_id":"20260918T070507Z-9b6874a8f1fe-oracle-v3","intraday_bias":"NEUTRAL","macro_bias":"BEARISH","market":"DOTUSD","measurement_config_sha256":"b0419c4ed2b156a6723551ea2a8cd5b32c6ed08f70261b6c0bad818b0fe445a9","oracle_config_sha256":"298a079a85bb0cc92ff6438699b9dac212f8beba447537a596ce61a9e8f3fe77","oracle_feature_version":"3.0.0","paths":{"alternative":{"then":"EXHAUSTION_WATCH und NO_TRADE beibehalten; eine Konsolidierung oder einen neuen geschlossenen Reclaim abwarten.","when":"Der laufende Reclaim \u00fcber 1.14 USD scheitert erneut, aber die volumenstarke Spot-Zone 1.120 bis 1.125 USD und danach 1.0915 USD halten.","why":"Die letzte geschlossene 1h-Kerze zeigt einen failed_breakout an 1.14 USD, Breadth fiel auf 0 Prozent positive Peers und DOT/BTC verlor auf 1h. Die best\u00e4tigte bullische 1h-Struktur ist jedoch noch intakt."},"primary":{"then":"1.1642 USD als erste Reaktionszone pr\u00fcfen; dar\u00fcber 1.1811576 USD und danach 1.2457 USD. Wegen der schwachen Restasymmetrie folgt daraus kein automatischer Neueinstieg.","when":"Eine vollst\u00e4ndig geschlossene 1h-Kerze schliesst \u00fcber 1.14 USD und der Markt h\u00e4lt auf Schlusskursbasis den A-AVWAP bei 1.08259622534 USD.","why":"Die 1h-Struktur bleibt HL/HH, die 4h-ATR-Struktur HH/HL, der Perp-Flow ist positiv und OI steigt auf 4h mit dem Preis. Ein geschlossener Reclaim w\u00fcrde den aktuellen failed_breakout an 1.14 USD neutralisieren."},"squeeze_failure":{"then":"Die unmittelbare Fortsetzungsthese deutlich abschw\u00e4chen. Unter 1.0546 USD bricht das j\u00fcngste best\u00e4tigte 1h-HL; darunter liegen der B-AVWAP bei 1.03424632346 USD und der C-AVWAP bei 1.01780445104 USD.","when":"Eine vollst\u00e4ndig geschlossene 1h-Kerze f\u00e4llt unter den A-AVWAP bei 1.08259622534 USD.","why":"Der A-AVWAP ist die n\u00e4chste belastbare Mittelwertzone unter dem Impuls. 1.0546 USD ist das j\u00fcngste best\u00e4tigte 1h-Higher-Low und damit die wichtigere strukturelle Grenze."}},"primary_market":"SPOT","regime":"EXHAUSTION_WATCH","schema_version":1,"snapshot_generated_at_utc":"2026-09-18T06:50:48.267553Z","snapshot_sha256":"9b6874a8f1fe4922ea0edf4ee2c5274adbaaf52df98385e1b52061936dac451c","strategy_version":"oracle-v3.0.0","swing_bias":"BULLISH","text_summary":"REFLOOP: Der letzte persistierte Forecast 20260918T060650Z-8bc30ebf0cf5-oracle-v3 ist vollst\u00e4ndig archiviert und per Receipt an den serverseitig verifizierten Input gebunden; seine 1h-, 4h- und 12h-Horizonte stehen am Analyse-SHA auf pending. Neues Feedback: (20260918T020431Z-508f93b3f3f1-oracle-v3, 4h, 1.0.0) = abstained, forward_return +1.3198 Prozent, MFE +2.7025 Prozent, MAE -0.3771 Prozent, kein Trigger, kein Entry und kein R. Der urspr\u00fcngliche 4h-Horizont war UP. Grenze: NO_TRADE bleibt kein Trade-Nachweis. Konsequenz: 4h-Richtung und Ausf\u00fchrung weiter getrennt halten. Neues Feedback: (20260918T050327Z-b284c7861a73-oracle-v3, 1h, 1.0.0) = abstained, forward_return -0.2296 Prozent, MFE +1.0155 Prozent, MAE -1.1745 Prozent, kein Trigger, kein Entry und kein R. Der urspr\u00fcngliche 1h-Horizont war FLAT. Grenze: Das Ergebnis zeigt eine breite zweiseitige Bewegung und belegt kein Reversal. Konsequenz: Nach dem failed_breakout an 1.14 USD weiterhin geschlossene Struktur-Best\u00e4tigung verlangen. Aktuell: Makro bearish, Swing bullish, 1h FLAT, 4h UP; EXHAUSTION_WATCH wegen failed_breakout an 1.14 USD, schwacher 1h-Relativbreite und fallendem 1h-OI, w\u00e4hrend der Live-Spot 1.14 intrabar erneut \u00fcberschritten hat und der Perp-Flow positiv ist.","trade_setup":{"asymmetry":{"assessment":"UNFAVOURABLE","reason":"Ein neuer Long direkt um 1.14 USD bietet bis 1.1642 USD gegen den A-AVWAP bei 1.08259622534 USD nur rund 0.42 R vor Geb\u00fchren, Spread und Slippage. Ein Short ist ebenfalls nicht best\u00e4tigt, weil abc_ready=false, new_structure_confirmation=false und trigger_candidate=false.","reward_risk_t1":null},"direction":"NONE","failure":null,"failure_scope":"setup_and_trade","status":"NO_TRADE","target_roles":{"T1":"Kein aktives Setup; 1.1642 USD ist nach einem best\u00e4tigten 1h-Reclaim von 1.14 USD die n\u00e4chste belegte 4h-Reaktionszone.","T2":"Kein aktives Setup; 1.1811576 USD ist das exportierte 0.786-Retracement und eine m\u00f6gliche Mean-Reversion- oder Umkehrzone.","T3":"Kein aktives Setup; 1.2457 USD ist das best\u00e4tigte 4h-ATR-Zigzag-Hoch und die gr\u00f6ssere strukturelle Entscheidung."},"targets":[],"trigger":null}}
