{"calibration_context":{"analog_sample_count":13,"confidence":"LOW","limitations":["oracle_context ist partial.","1h-Analogs haben 13, 4h-Analogs 4 und 12h-Analogs 1 Sample bei minimum_samples 20.","OI- und Flow-Perzentile haben erst 25 historische Vergleichspunkte bei minimum_samples 168.","Die passende NO_TRADE-Scorecard hat auf 1h 4, auf 4h 6 und auf 12h 0 directional Samples bei minimum_samples 30; resolved triggered Trades sind 0.","Die Reversal-Gates stehen auf abc_ready=false und trigger_candidate=false; daher kein REVERSAL_ARMED oder REVERSAL_TRIGGERED.","Die letzte 1h-Kerze, Breadth und 1h-Relativst\u00e4rke sind schwach, w\u00e4hrend der Live-Spot intrabar etwas zur\u00fcckgewinnt. Diese Mischung liefert keine saubere Execution-Asymmetrie."],"scorecard_sample_count":4,"status":"uncalibrated"},"created_at_utc":"2026-09-17T23:02:47Z","evidence":{"decisive_timeframes":["1h","4h","12h","1w"],"opposing_feature_ids":["candle.1h.clv","breadth.1h.positive_fraction","breadth.1h.turn_pp","relative.1h.ratio_return_pct","relative.1h.acceleration_pp","relative.4h.acceleration_pp","flow.spot.signed_dot","flow.perp.signed_dot","oi.4h.price_relation"],"supporting_feature_ids":["structure.1h.transition","relative.24h.ratio_return_pct","oi.1h.price_relation"]},"execution_bias":"NEUTRAL","forecast_horizons":{"12h":{"direction":"ABSTAIN","rationale":"Der letzte geschlossene 12h-Block stammt aus der fr\u00fcheren Tagesh\u00e4lfte und bildet den j\u00fcngsten Anstieg nicht ab. Weekly bleibt strukturell LH/LL und Analog- sowie Scorecard-Stichproben reichen nicht f\u00fcr einen belastbaren 12h-Richtungscall."},"1h":{"direction":"FLAT","rationale":"Die letzte geschlossene 1h-Kerze fiel von 1.0757 auf 1.0619 USD und schloss mit CLV 0.035 fast am Tief. Die 1h-Breadth liegt bei 0 Prozent, DOT/BTC verlor auf 1h rund 1.06 Prozent und Spot- sowie Perp-Signed-Flow sind negativ. Der Live-Spot bei 1.0719 USD erholt sich intrabar, liegt aber weiter unter dem A-AVWAP und dem best\u00e4tigten HH."},"4h":{"direction":"FLAT","rationale":"DOT/BTC liegt auf 4h nur rund 0.07 Prozent h\u00f6her und die relative Beschleunigung ist mit rund minus 2.77 Prozentpunkten klar negativ. Preis liegt gegen\u00fcber vier Stunden zuvor h\u00f6her, OI jedoch rund 0.15 Prozent tiefer. Die 1h-Struktur bleibt HL/HH, die 4h-Struktur ist gemischt."}},"forecast_id":"20260917T230247Z-e4557240062f-oracle-v3","intraday_bias":"NEUTRAL","macro_bias":"BEARISH","market":"DOTUSD","measurement_config_sha256":"b0419c4ed2b156a6723551ea2a8cd5b32c6ed08f70261b6c0bad818b0fe445a9","oracle_config_sha256":"298a079a85bb0cc92ff6438699b9dac212f8beba447537a596ce61a9e8f3fe77","oracle_feature_version":"3.0.0","paths":{"alternative":{"then":"NO_TRADE beibehalten und die Konsolidierung abwarten.","when":"DOT h\u00e4lt auf 1h \u00fcber 1.0389 USD, bleibt aber unter 1.08156195796 USD.","why":"Der Swing bleibt bullisch, doch die letzte 1h-Kerze schloss fast am Tief, die Breadth liegt bei 0 Prozent und Spot sowie Perp zeigen negativen Signed-Flow."},"primary":{"then":"1.14 USD als n\u00e4chste belegte Reaktionszone pr\u00fcfen; dar\u00fcber 1.27 USD als strukturelle Entscheidungszone. Einen neuen Einstieg nur bei besserer Asymmetrie erw\u00e4gen und nicht in eine laufende Kerze jagen.","when":"Eine vollst\u00e4ndig geschlossene 1h-Kerze schliesst \u00fcber dem A-AVWAP bei 1.08156195796 USD und dem best\u00e4tigten 1h-HH bei 1.0808 USD, w\u00e4hrend 1.0389 USD auf Schlusskursbasis h\u00e4lt.","why":"Die best\u00e4tigte 1h-Struktur bleibt HL/HH und DOT ist auf 24h klar st\u00e4rker als BTC. Kurzfristig fehlen aber Breadth, relative St\u00e4rke und positiver ausgef\u00fchrter Flow."},"squeeze_failure":{"then":"Die unmittelbare Fortsetzungsthese abschw\u00e4chen; der B-AVWAP bei 1.02934451489 USD wird die erste untere Reaktionszone. Darunter folgen der C-AVWAP bei 1.00864233181 USD und das best\u00e4tigte 1h-HL bei 1.0033 USD.","when":"Eine vollst\u00e4ndig geschlossene 1h-Kerze f\u00e4llt unter 1.0389 USD.","why":"1.0389 USD ist der fr\u00fchere best\u00e4tigte Breakout-Level. Ein Schluss unter 1.0033 USD w\u00fcrde zus\u00e4tzlich das j\u00fcngste best\u00e4tigte 1h-HL brechen."}},"primary_market":"SPOT","regime":"NO_TRADE","schema_version":1,"snapshot_generated_at_utc":"2026-09-17T22:50:57.978874Z","snapshot_sha256":"e4557240062fd88c4f4ec22b71f59db31e9c34fa567938c6591983d8c8f126d0","strategy_version":"oracle-v3.0.0","swing_bias":"BULLISH","text_summary":"REFLOOP: Der letzte persistierte Forecast 20260917T220513Z-b1fbf7e434b0-oracle-v3 ist vollst\u00e4ndig archiviert und per Receipt an den serverseitig verifizierten Input gebunden; 1h, 4h und 12h stehen am Analyse-SHA noch auf pending. Erstmals konsultiert (20260917T100443Z-8c997eb57ee6-oracle-v3, 12h, 1.0.0): abstained, forward_return +4.2440 Prozent, MFE +7.7280 Prozent, MAE -0.1382 Prozent; kein Trigger, kein Entry und kein R. Konsequenz: kein Trade- oder Richtungsnachweis, 12h bleibt ABSTAIN. Erstmals konsultiert (20260917T210458Z-c33fcdd7cabe-oracle-v3, 1h, 1.0.0): abstained, forward_return -1.2251 Prozent, MFE +0.5050 Prozent, MAE -1.3373 Prozent; urspr\u00fcnglicher 1h-Horizont UP, aber NO_TRADE ohne Trigger oder Entry. Grenze: ein Einzelfall und kein Trade. Konsequenz: frische Intrabar-St\u00e4rke nicht fortschreiben; 1h aktuell FLAT und Schlussbest\u00e4tigung \u00fcber A-AVWAP plus HH bleibt Pflicht. Keine Schwellen\u00e4nderung. Aktuell: Makro bearish, Swing bullish, Intraday neutral; NO_TRADE, weil 1h-Breadth und relative St\u00e4rke schwach sind und bis zum A-AVWAP gegen den B-AVWAP nur rund 0.23 R verbleiben.","trade_setup":{"asymmetry":{"assessment":"UNFAVOURABLE","reason":"Vom Snapshot-Spot bei 1.0719 USD bis zum A-AVWAP bei 1.08156195796 USD bleiben gegen den B-AVWAP bei 1.02934451489 USD nur rund 0.23 R vor Geb\u00fchren, Spread und Slippage. Ohne best\u00e4tigten 1h-Ausbruch gibt es keinen sauberen neuen Einstieg.","reward_risk_t1":null},"direction":"NONE","failure":null,"failure_scope":"setup_and_trade","status":"NO_TRADE","target_roles":{"T1":"Kein aktives Setup; der A-AVWAP bei 1.08156195796 USD ist die n\u00e4chste obere Reaktionszone und liegt direkt \u00fcber dem best\u00e4tigten 1h-HH bei 1.0808 USD.","T2":"Kein aktives Setup; 1.14 USD bleibt die n\u00e4chste belegte h\u00f6here Mean-Reversion- und Entscheidungszone.","T3":"Kein aktives Setup; 1.27 USD bleibt die h\u00f6here strukturelle Entscheidungszone."},"targets":[],"trigger":null}}
