{"calibration_context":{"analog_sample_count":13,"confidence":"LOW","limitations":["oracle_context ist partial.","Die aktuellen Markt-Analogs haben 13 Samples auf 1h, 5 auf 4h und 1 auf 12h und liegen jeweils unter minimum_samples 20.","F\u00fcr ein kompatibles 1h-SHORT-Setup im Regime BREAKOUT_ARMED ist im gelesenen Scorecard-Stand keine belastbare Richtungsstichprobe vorhanden; minimum_samples betr\u00e4gt 30.","OI- und Flow-Perzentile haben erst 85 historische Vergleichspunkte bei minimum_samples 168 und sind unavailable.","Spot- und Perp-efficiency_loss sind im aktuellen Feature-Satz unavailable. Positiver Perp-Nettoflow bei fallendem Preis beweist keine Teilnehmeridentit\u00e4t oder Absorption.","Downside und Upside haben abc_ready=false und trigger_candidate=false; deshalb kein REVERSAL_ARMED oder REVERSAL_TRIGGERED.","Der aktuelle Spot von 1.0917 USD ist intrabar. Der letzte vollst\u00e4ndige 1h-Schluss liegt bei 1.1023 USD. Der SHORT ist deshalb nur ARMED und nicht TRIGGERED.","Die aktuelle 4h- und 12h-Kerze sind offen; der laufende R\u00fcckfall darf auf diesen Horizonten nicht als Schlussbruch behandelt werden."],"scorecard_sample_count":0,"status":"uncalibrated"},"created_at_utc":"2026-09-20T11:04:53Z","evidence":{"decisive_timeframes":["1h","4h","12h","1d","1w"],"opposing_feature_ids":["structure.1h.transition","structure.4h.transition","relative.1h.ratio_return_pct","relative.4h.ratio_return_pct","breadth.1h.positive_fraction","levels.1h.reactions","flow.perp.signed_dot"],"supporting_feature_ids":["flow.spot.signed_dot","flow.spot.alignment","oi.1h.price_relation","flow.perp.divergence","candle.4h.clv"]},"execution_bias":"BEARISH","forecast_horizons":{"12h":{"direction":"FLAT","rationale":"Daily bleibt HH/HL, Weekly LH/LL und die aktuelle 12h-Kerze ist noch offen. Das neue kompatible 12h-Python-Outcome eines \u00e4lteren FLAT-Calls endete abstained bei rund -0.14 Prozent mit grosser Intrahorizon-Spanne. Das kalibriert keine Richtung. Deshalb bleibt 12h FLAT."},"1h":{"direction":"DOWN","rationale":"Die 09:00-10:00-UTC-Kerze schloss bei 1.1023 USD \u00fcber 1.1019 USD und best\u00e4tigte den Reclaim. Im anschliessenden vollst\u00e4ndigen Flowfenster fiel Spot jedoch von 1.1027 auf 1.0924 USD bei rund -9953 DOT Nettoflow; das 1h-OI stieg leicht bei fallendem Preis. DOT/BTC und die 1h-Breadth bleiben dagegen stark. Deshalb ist die 1h-Richtung bedingt DOWN, die Ausf\u00fchrung wartet aber auf einen vollst\u00e4ndigen 1h-Schluss unter 1.0935 USD."},"4h":{"direction":"FLAT","rationale":"Die best\u00e4tigte 4h-Struktur wechselte zu HL/LH, DOT/BTC ist auf 4h relativ stark und Preis liegt gegen\u00fcber vier Stunden zuvor h\u00f6her, w\u00e4hrend OI sank. Die aktuelle 08:00-12:00-UTC-Kerze ist noch offen; der laufende R\u00fcckfall darf deshalb nicht als best\u00e4tigter 4h-Bruch gelten. Der fr\u00fchere 4h-DOWN-Call wird auf FLAT zur\u00fcckgestuft."}},"forecast_id":"20260920T110453Z-d4ce9e64c260-oracle-v3","intraday_bias":"BEARISH","macro_bias":"NEUTRAL","market":"DOTUSD","measurement_config_sha256":"b0419c4ed2b156a6723551ea2a8cd5b32c6ed08f70261b6c0bad818b0fe445a9","oracle_config_sha256":"298a079a85bb0cc92ff6438699b9dac212f8beba447537a596ce61a9e8f3fe77","oracle_feature_version":"3.0.0","paths":{"alternative":{"then":"1.109497 USD als erste Reaktion, 1.115461 USD als Mean-Reversion-Marke und 1.123839 bis 1.129022 USD als strukturelle Entscheidungszone pr\u00fcfen.","when":"Eine vollst\u00e4ndig geschlossene 1h-Kerze schliesst wieder \u00fcber 1.1019 USD.","why":"Der vorherige 1h-Schluss \u00fcber 1.1019 USD, die HL/LH-Struktur, DOT/BTC-Relativst\u00e4rke und breite Altcoin-Erholung st\u00fctzen den Rebound, sofern der aktuelle R\u00fccksetzer als Retest h\u00e4lt."},"primary":{"then":"Das SHORT-Setup aktivieren: T1 1.0797 USD, T2 1.0707 USD, T3 am B/C-AVWAP-Cluster bei rund 1.06302 bis 1.06154 USD. Nicht vor dem Stundenschluss in den laufenden R\u00fccksetzer springen.","when":"Eine vollst\u00e4ndig geschlossene 1h-Kerze schliesst unter 1.0935 USD.","why":"Der best\u00e4tigte Reclaim \u00fcber 1.1019 USD wurde bis 10:50 UTC vollst\u00e4ndig zur\u00fcckverkauft. Spot-Flow ist negativ und aligned, das 1h-OI steigt leicht bei fallendem Preis und der Markt handelt wieder am A-AVWAP. Ein Schluss unter 1.0935 USD w\u00fcrde den Reclaim als gescheitert best\u00e4tigen. Die starke DOT/BTC-Relativst\u00e4rke und 100-Prozent-Breadth verlangen genau diese Schlussbest\u00e4tigung."},"squeeze_failure":{"then":"Den Short- und Failed-Breakout-Case deutlich zur\u00fcckstufen. Danach liegen 1.123839 bis 1.129022 USD und anschliessend 1.1374 USD als strukturelle Marken.","when":"Eine vollst\u00e4ndig geschlossene 1h-Kerze schliesst \u00fcber 1.117 USD.","why":"Ein Schluss \u00fcber 1.117 USD w\u00fcrde den Reclaim nicht nur wiederherstellen, sondern den Markt tiefer in den fr\u00fcheren Swing zur\u00fcckf\u00fchren."}},"primary_market":"SPOT","regime":"BREAKOUT_ARMED","schema_version":1,"snapshot_generated_at_utc":"2026-09-20T10:50:54.065482Z","snapshot_sha256":"d4ce9e64c260cf89617ef0f6fd78805b55787c41f446be29ef90e6770500304e","strategy_version":"oracle-v3.0.0","swing_bias":"NEUTRAL","text_summary":"REFLOOP: Letzter persistierter Forecast ist 20260920T090334Z-b6ae5c1ae6d2-oracle-v3; Forecast und Receipt liegen am Analyse-SHA vor. Der danach eingereichte Entwurf 20260920T100355Z-fc1e583faf1d-oracle-v3 wurde vom Writer abgelehnt und ist nicht persistiert; er z\u00e4hlt nicht als Forecast- oder Outcome-Stichprobe. Neues Feedback: (20260920T090334Z-b6ae5c1ae6d2-oracle-v3, 1h, 1.0.0) = abstained, forward_return +0.6965 Prozent, MFE +1.5121 Prozent, MAE -0.2199 Prozent, kein Trigger, kein Entry und kein R. Der urspr\u00fcngliche 1h-Horizont war FLAT. Grenze: NO_TRADE ist weder Gewinn noch Verlust und ein Einzelfall kalibriert keine Richtung. Konsequenz: Der Markt stieg in diesem Fenster klar statt flach; der aktuelle bedingte DOWN-Call beruht auf dem danach frisch gemessenen gescheiterten Reclaim, nicht auf diesem Outcome allein. Neues Feedback: (20260920T060235Z-11841ad06979-oracle-v3, 4h, 1.0.0) = abstained, forward_return +1.2687 Prozent, MFE +1.8387 Prozent, MAE -0.7355 Prozent, kein Trigger, kein Entry und kein R. Der urspr\u00fcngliche 4h-Horizont war DOWN. Grenze: kein Trade und nur ein einzelnes Ergebnis. Konsequenz: Zusammen mit HL/LH-Struktur und 4h-Relativst\u00e4rke wird 4h auf FLAT zur\u00fcckgestuft. Neues Feedback: (20260919T220106Z-70befdc24e65-oracle-v3, 12h, 1.0.0) = abstained, forward_return -0.1358 Prozent, MFE +2.5437 Prozent, MAE -3.0778 Prozent, kein Trigger, kein Entry und kein R. Der urspr\u00fcngliche 12h-Horizont war FLAT. Grenze: breite Intrahorizon-Spanne und keine Trade-Kalibration. Konsequenz: 12h bleibt FLAT. Elliott-Hierarchie: 0.9342 bis 0.9441 USD bleibt die h\u00f6here Wave-2-Ursprungszone. Das Tief 1.0707 USD kann das lokale Ende einer tieferen Unterwelle 2 sein, ist auf ATR-Zigzag-Ebene aber nicht als neuer Tiefpivot best\u00e4tigt. Das best\u00e4tigte Fraktal-Higher-Low bei 1.0797 USD und HL/LH verbessern den lokalen Count. Der geschlossene Reclaim \u00fcber 1.1019 USD st\u00e4rkte diese Erholung, wurde bis 10:50 UTC jedoch zur\u00fcckverkauft. Ein 1h-Schluss unter 1.0935 USD w\u00fcrde den lokalen Reclaim als gescheitert behandeln, ohne die h\u00f6here bullische Arbeitsthese zu invalidieren. Aktuell: Macro neutral, Swing neutral, Intraday bearish, 1h DOWN, 4h FLAT, 12h FLAT; Execution SHORT ARMED.","trade_setup":{"asymmetry":{"assessment":"FAVOURABLE","reason":"Vom Trigger 1.0935 USD bis T1 1.0797 USD liegen 0.0138 USD, bis zur Failure 1.1019 USD 0.0084 USD. Das sind rund 1.64 R vor Spread, Geb\u00fchren und Slippage. Der Close-Trigger verhindert einen intrabar Short in die laufende Retest-Zone.","reward_risk_t1":1.64285714286},"direction":"SHORT","failure":{"description":"Nach Aktivierung verwirft ein erneuter Touch \u00fcber 1.1019 USD den Short und zeigt, dass der Reclaim wieder tr\u00e4gt.","interval_minutes":1,"kind":"touch_above","price_usd":1.1019},"failure_scope":"after_trigger","status":"ARMED","target_roles":{"T1":"Reaktion am best\u00e4tigten 1h-Fraktal-Higher-Low bei 1.0797 USD.","T2":"Test des best\u00e4tigten 1h-Fraktal-Lows bei 1.0707 USD.","T3":"Strukturelle Entscheidung am oberen Rand des B/C-AVWAP-Clusters bei rund 1.06302 bis 1.06154 USD."},"targets":[{"id":"T1","price_usd":1.0797},{"id":"T2","price_usd":1.0707},{"id":"T3","price_usd":1.06301633208}],"trigger":{"description":"Aktivierung erst bei einem vollst\u00e4ndig geschlossenen 1h-R\u00fcckfall unter 1.0935 USD nach dem best\u00e4tigten Reclaim \u00fcber 1.1019 USD.","interval_minutes":60,"kind":"close_below","price_usd":1.0935}}}
